{
  "$schema": "https://json-schema.org/draft/2020-12/schema",
  "title": "EvaluatorOwnedImprovementCampaignV2",
  "type": "object",
  "required": ["campaign_id", "campaign_version", "status", "max_iterations", "baseline_policy_path", "frozen_surfaces", "candidate_change_allowlist", "trusted_paths"],
  "properties": {
    "campaign_id": {"type": "string", "pattern": "^[a-z0-9][a-z0-9-]*$"},
    "campaign_version": {"const": 2},
    "status": {"const": "experimental"},
    "max_iterations": {"type": "integer", "minimum": 1, "maximum": 10},
    "baseline_policy_path": {"type": "string", "minLength": 1},
    "frozen_surfaces": {"type": "array", "uniqueItems": true, "minItems": 5, "maxItems": 5, "items": {"enum": ["task_matrices", "evaluator_and_judges", "runtime_envelope", "payload_contracts", "trusted_manifest"]}},
    "candidate_change_allowlist": {"type": "array", "uniqueItems": true, "minItems": 6, "maxItems": 6, "items": {"enum": ["roles", "guidance", "safe_nodes", "edges", "joins", "loop_bounds"]}},
    "trusted_paths": {"type": "array", "minItems": 1, "uniqueItems": true, "items": {"type": "string", "minLength": 1}},
    "resource_budget": {"type": "object"}
  },
  "additionalProperties": false
}
